Product Name,Brand Name,Price,Rating,Reviews,Review Votes
Apple iPhone 6 a1549 16GB Space Gray Unlocked (Certified Refurbished),Apple,379.99,5,"An excellent product. It arrived on time, in a new box, unlocked and worked very well. There were a few small blemishes, but that is to be expected with a refurbished product. The home button sticks on occasionally that was easily fixed with rubbing alcohol (isopropyl alcohol) on a cotton swab, applied to the home button with the phone turned off, lightly tapped for 30 seconds, and then let sit for 5 minutes. I live in East Africa, and this phone works perfectly well using the local cell phone carrier.",2
Apple iPhone 6 a1549 16GB Space Gray Unlocked (Certified Refurbished),Apple,379.99,5,We were a little nervous about ordering this phone. We don't regret it! Looks and works perfectly for a great price!,1
Apple iPhone 6 a1549 16GB Space Gray Unlocked (Certified Refurbished),Apple,379.99,5,It s a great phone working perfectly!,0
Apple iPhone 6 a1549 16GB Space Gray Unlocked (Certified Refurbished),Apple,379.99,5,I have had this phone for 5 months now and it is still in great condition. It came in a box and charger. Very satisfied with the phone and price,1
Apple iPhone 6 a1549 16GB Space Gray Unlocked (Certified Refurbished),Apple,379.99,5,"Great condition, works with At&T",0
Apple iPhone 6 a1549 16GB Space Gray Unlocked (Certified Refurbished),Apple,379.99,1,While the phone was a refurbished one three different carriers couldn't get it to activate to receive calls . Not much value in that !! A waste of money!!!!,0
Apple iPhone 6 a1549 16GB Space Gray Unlocked (Certified Refurbished),Apple,379.99,5,good,1
Apple iPhone 6 a1549 16GB Space Gray Unlocked (Certified Refurbished),Apple,379.99,1,Its working just fine i rate it a 5 star.... My daughter is very happy and Pleased with it....,0
Apple iPhone 6 a1549 16GB Space Gray Unlocked (Certified Refurbished),Apple,379.99,5,Works perfectly fine and looks brand new no scratches or anything. Camera works great it was definitely worth the money for a good price...I think the people that wrote a bad review just got a bad phone sent to them also battery last a long time and it comes with just the charger no headphone it came with a brand new charger not a used one it works perfectly fine with Metro pcs for only $40 a month with 3GS pretty fast delivery.,2
Apple iPhone 6 a1549 16GB Space Gray Unlocked (Certified Refurbished),Apple,379.99,2,"Glitches and freezes a lot while useing it, espeacially while texting....",0
Apple iPhone 6 a1549 16GB Space Gray Unlocked (Certified Refurbished),Apple,379.99,1,"This is the first time I bought a refurbished iphone and my last one. I regret buying this phone big time!Fully charged battery will just run for 15mins after less than 3 months of use! Home button started acting up, and power button won't work.If you are buying a refurbished phone, it's like a box of chocolates. You never know what you're gonna get!To sum it all up, it's like a gamble with your $400, just get a used phone from someone you know personally or a friend. Also a better option would be, a promo deal with phone company providers or get an installment deal with Apple Store. Never a refurbished phone.",9
Apple iPhone 6 a1549 16GB Space Gray Unlocked (Certified Refurbished),Apple,379.99,5,This iPhone was amazing and it came on time,1
Apple iPhone 6 a1549 16GB Space Gray Unlocked (Certified Refurbished),Apple,379.99,5,Perfect,14
Apple iPhone 6 a1549 16GB Space Gray Unlocked (Certified Refurbished),Apple,379.99,5,Great phone. Everything about this phone is great. Love it.,3
Apple iPhone 6 a1549 16GB Space Gray Unlocked (Certified Refurbished),Apple,379.99,5,I am very impressed with the quality and performance of this Iphone 6. I bought this for my teenage son and he won't put it down. So it was a very good buy and I would buy one again from this seller.,4
Apple iPhone 6 a1549 16GB Space Gray Unlocked (Certified Refurbished),Apple,379.99,4,"I love this product, I received mine with a bit of scratches on the back of the phone but it works perfectly.",22
Apple iPhone 6 a1549 16GB Space Gray Unlocked (Certified Refurbished),Apple,379.99,3,"Yes, but home button is not working OK",0
Apple iPhone 6 a1549 16GB Space Gray Unlocked (Certified Refurbished),Apple,379.99,3,"It works well, but some scratches exist on the back of the phone. It can also use in south Korea.(한국에서 잘 됩니다. 언락 맞음)",0
Apple iPhone 6 a1549 16GB Space Gray Unlocked (Certified Refurbished),Apple,379.99,5,Great phone great service,3
Apple iPhone 6 a1549 16GB Space Gray Unlocked (Certified Refurbished),Apple,379.99,5,Came fast and works really good,1
Apple iPhone 6 a1549 16GB Space Gray Unlocked (Certified Refurbished),Apple,379.99,4,"My phone came like it was new. No scratches at all. It took time to warm up so I thought something was still wrong with it, but it works just as fine and probably just needed to warm up before it started working well. Great for the price!",1
Apple iPhone 6 a1549 16GB Space Gray Unlocked (Certified Refurbished),Apple,379.99,5,So far I have been completely satisfied with the product. It was within two days everything in the phone is functioning completely well and up to date. I would recommend this other buyers this deserves its 5 stars. They're very professional and nice.,17
Apple iPhone 6 a1549 16GB Space Gray Unlocked (Certified Refurbished),Apple,379.99,5,Showed up FAST!! Works perfectly and it's a lot more affordable then buying a new one. Very pleased with my purchase.,39
Apple iPhone 6 a1549 16GB Space Gray Unlocked (Certified Refurbished),Apple,379.99,4,"This phone came quickly, looked new, no scratches or anything. Worked fine for 6 months then the power button started sticking, or the screen would stick, or the screen would roll down once I started typing. Now I'm at 7 months and it's not keeping the charge and even when plugged in for hours charges really slowly. I have no recourse at this point. Just doing this review so you can be aware.",0
Apple iPhone 6 a1549 16GB Space Gray Unlocked (Certified Refurbished),Apple,379.99,5,Good Phone So Far No Problems!!,0
Apple iPhone 6 a1549 16GB Space Gray Unlocked (Certified Refurbished),Apple,379.99,5,I bought this phone for my son. The phone looked great when it arrived and works well too. He loves it!!!,0
Apple iPhone 6 a1549 16GB Space Gray Unlocked (Certified Refurbished),Apple,379.99,1,Bad,0
Apple iPhone 6 a1549 16GB Space Gray Unlocked (Certified Refurbished),Apple,379.99,5,Yes the phone was basically new I was nervous reading some of the reviews but I love it even better than my last one,0
Apple iPhone 6 a1549 16GB Space Gray Unlocked (Certified Refurbished),Apple,379.99,1,Item is having scratches and lilltle damaged. There is no earphones in the package received. Really dissappointed.,0
Apple iPhone 6 a1549 16GB Space Gray Unlocked (Certified Refurbished),Apple,379.99,5,I am always concerned purchasing electronic things off of a mail order place. This phone was in Perfect Condition. It was actually better than I expected.,0
Apple iPhone 6 a1549 16GB Space Gray Unlocked (Certified Refurbished),Apple,379.99,4,"It was in great condition and worked great, but only for like 3 days then I lost service and couldn't connect back. They don't tell you it's a Verizon phone but it's not a big deal because verizon doesn't lock their phones. I have T-Mobile and for some reason it just stopped working and neither verizon or T-Mobile knew what to do, so I sent the phone back to get a refund. Still was in great condition and worked great but it might depend on your carrier.",0
Apple iPhone 6 a1549 16GB Space Gray Unlocked (Certified Refurbished),Apple,379.99,5,👌🏾,0
Apple iPhone 6 a1549 16GB Space Gray Unlocked (Certified Refurbished),Apple,379.99,5,Very satisfied. 5 star,0
Apple iPhone 6 a1549 16GB Space Gray Unlocked (Certified Refurbished),Apple,379.99,4,"Working well, but I am still learning to use it.",2
Apple iPhone 6 a1549 16GB Space Gray Unlocked (Certified Refurbished),Apple,379.99,1,Was not as it listed,0
Apple iPhone 6 a1549 16GB Space Gray Unlocked (Certified Refurbished),Apple,379.99,5,Everything was 👌!!!!#,1
Apple iPhone 6 a1549 16GB Space Gray Unlocked (Certified Refurbished),Apple,379.99,5,"Loving my phone so far, came with no scratches and basically looked brand new. Functions properly and is just amazing '",2
Apple iPhone 6 a1549 16GB Space Gray Unlocked (Certified Refurbished),Apple,379.99,5,Excelent product,1
Apple iPhone 6 a1549 16GB Space Gray Unlocked (Certified Refurbished),Apple,379.99,1,I 've used one month doesn't work home buttonPls don't buy this one and my friend same problem,1
Apple iPhone 6 a1549 16GB Space Gray Unlocked (Certified Refurbished),Apple,379.99,5,Exccelent,1
Apple iPhone 6 a1549 16GB Space Gray Unlocked (Certified Refurbished),Apple,379.99,4,"It came in a great condition, and quicker than expected. The only problem I've had with it is it glitches up every once in a while. I'll probably call AT&T and see if they have anything to say about it if it continues, it's happened like 3 times in the last month and a half but doesn't last long. Other than that it's so great!!",3
Apple iPhone 6 a1549 16GB Space Gray Unlocked (Certified Refurbished),Apple,379.99,5,I think that is the best order mine at amazon. It came without any defect . Working perfect by 2 months already and im really satisfied,2
Apple iPhone 6 a1549 16GB Space Gray Unlocked (Certified Refurbished),Apple,379.99,4,Phone is in great condition & has no functional issues. I'm satisfied with my purchase,3
Apple iPhone 6 a1549 16GB Space Gray Unlocked (Certified Refurbished),Apple,379.99,5,Very good,4
Apple iPhone 6 a1549 16GB Space Gray Unlocked (Certified Refurbished),Apple,379.99,5,Item received in the expected conditions. Love my new phone,6
Apple iPhone 6 a1549 16GB Space Gray Unlocked (Certified Refurbished),Apple,379.99,4,Product was in excellent condition,3
Apple iPhone 6 a1549 16GB Space Gray Unlocked (Certified Refurbished),Apple,379.99,5,Looks 100% like a new one,4
Apple iPhone 6 a1549 16GB Space Gray Unlocked (Certified Refurbished),Apple,379.99,5,it shipped faster than expected but i love the phone,7
Apple iPhone 6 a1549 16GB Space Gray Unlocked (Certified Refurbished),Apple,379.99,5,Good,4
Apple iPhone 6 a1549 16GB Space Gray Unlocked (Certified Refurbished),Apple,379.99,5,Great phone! ;),3
Apple iPhone 6 a1549 16GB Space Gray Unlocked (Certified Refurbished),Apple,379.99,5,Lovvvee it,3
Apple iPhone 6 a1549 16GB Space Gray Unlocked (Certified Refurbished),Apple,379.99,5,"Extremely pleased with this purchase, at first I thought it was too good to be true but I made the Order and it was here in a matter of days and works very well no problems yet",19
Apple iPhone 6 a1549 16GB Space Gray Unlocked (Certified Refurbished),Apple,379.99,5,"Works perfectly, I haven't had any problems with it so far.",10
Apple iPhone 6 a1549 16GB Space Gray Unlocked (Certified Refurbished),Apple,379.99,4,The phone was great had no issues.....,2
Apple iPhone 6 a1549 16GB Space Gray Unlocked (Certified Refurbished),Apple,379.99,5,Everything was great! The product arrived promptly and in excellent condition.,2
Apple iPhone 6 a1549 16GB Space Gray Unlocked (Certified Refurbished),Apple,379.99,5,love it,
Apple iPhone 6 a1549 16GB Space Gray Unlocked (Certified Refurbished),Apple,379.99,5,Great condition. Exactly as described.,2
Apple iPhone 6 a1549 16GB Space Gray Unlocked (Certified Refurbished),Apple,379.99,5,Very great product. Was very nervous about ordering but it was perfect unlocked and didn't look used at ALL. I ordered it on the 14th and got it to days later. Very fast shipping and no hasel at all.,2
Apple iPhone 6 a1549 16GB Space Gray Unlocked (Certified Refurbished),Apple,379.99,3,"got phone in time, condition is OK, sides have minor and medium scratches, the front panel was replaced (something stuck under the front camera glass, its visible and annoying, since I see it all the time, but camera works fine).So far everything else works.",2
Apple iPhone 6 a1549 16GB Space Gray Unlocked (Certified Refurbished),Apple,379.99,5,My son loves it!!!,
Apple iPhone 6 a1549 16GB Space Gray Unlocked (Certified Refurbished),Apple,379.99,5,I was hesitant to buy the phone from mywit at first because it was used but it's A+ quality refurbished phone not disappointed one bit,3
Apple iPhone 6 a1549 16GB Space Gray Unlocked (Certified Refurbished),Apple,379.99,5,Works perfectly,
Apple iPhone 6 a1549 16GB Space Gray Unlocked (Certified Refurbished),Apple,379.99,4,"I was concerned about ordering a refurbished phone. But there were only 2 very small abrasions on the entire phone. The phone runs great and works as a iPhone should. My only regret is that I didn't look at the iPhone SE As I prefer the smaller 4 inch display. It's also faster and has better overall specs than the 6 and it was only $65 more. But if you prefer the larger display then I would recommend this. No problems with my AT&T SIM card, just popped it in before I turned the phone on and it worked just fine.",
Apple iPhone 6 a1549 16GB Space Gray Unlocked (Certified Refurbished),Apple,379.99,2,"It came with scratches and dents on three of its edges.and the worst part is the so-called refurbished phone did 382 battery cycles!The seller is called ""MyWit""",2
Apple iPhone 6 a1549 16GB Space Gray Unlocked (Certified Refurbished),Apple,379.99,2,It was scratched and Apple emblem was with defects. And the color was nor the same as my new iPad gold. Also memory 12 Gb instead of 16 GbBut not so bad for the price payed for refurbished phone. And it works well with Uzbekistan network,0
Apple iPhone 6 a1549 16GB Space Gray Unlocked (Certified Refurbished),Apple,379.99,1,"Disaster. The phone's reception was terrible and it had a short battery life. On top of that, the charger broke after a week with the phone saying that it wasn't a certified charger. The problem with cheap charger is that it kills your battery (or so they say). So, all those suspicious glowing reviews may not be happy after 6 months.Ok, so after all that I return it and, using my tracking number, I see that they received it. Then I waited for a refund, but it never came. I contact them and they said that I have to give them a tracking number in order to get a refund. That was not a part of the return policy. At that point I couldn't find my tracking number so I had to beg my post office for copy. Another waste of 2 hours.The worst part is that this phone isn't even a great deal. I got a new brand model from Boost mobile for the same price. If you want one on the Verizon network, then go with a Groupon deal - again, for the same price. Don't risk a refurbished unless there is a steep discount.Lastly, if you want a free phone, just buy one from these guys and return an empty box. Yes, they are so disorganized that they will give you a refund. I didn't do this, but you certainly can.",2
Apple iPhone 6 a1549 16GB Space Gray Unlocked (Certified Refurbished),Apple,379.99,5,"Looks brand new, fast delivery",
Apple iPhone 6 a1549 16GB Space Gray Unlocked (Certified Refurbished),Apple,379.99,5,Great product - works perfectly and looks brand new!,
Apple iPhone 6 a1549 16GB Space Gray Unlocked (Certified Refurbished),Apple,379.99,4,Didn't come cracked,
Apple iPhone 6 a1549 16GB Space Gray Unlocked (Certified Refurbished),Apple,379.99,5,Very pleased with Apple iPhone 6,
Apple iPhone 6 a1549 16GB Space Gray Unlocked (Certified Refurbished),Apple,379.99,1,Product was used one unlike what was explained in product info as unused.,5
Apple iPhone 6 a1549 16GB Space Gray Unlocked (Certified Refurbished),Apple,379.99,4,Comes with cracked screen,
Apple iPhone 6 a1549 16GB Space Gray Unlocked (Certified Refurbished),Apple,379.99,5,The cell phone is in perfect conditions! It looks and works like new,
"Apple iPhone 6 A1549 AT&T Cellphone, 16GB, Gold",Apple,489.99,2,Cosmetically flawed on the home screen. Lots of scratches. Biggest issue is the battery status of the iPhone I received. I am very disappointed that the phone was shipped with a battery that seems faulty. It constantly jumps around and dies extremely fast. I may end up purchasing a new battery for the phone.,7
"Apple iPhone 6 A1549 AT&T Cellphone, 16GB, Gold",Apple,489.99,5,Item arrived quickly and was described in a nice apple package. The phone is in great working order.,0
"Apple iPhone 6 A1549 AT&T Cellphone, 16GB, Gold",Apple,489.99,5,"I purchased mine from seller JD Auction Warehouse. Item was better than described. Works perfectly. It was shipped same day and arrived earlier than expected. I am extremely pleased with my purchase. It is the AT&T model, but it is unlocked. Extremely pleased with my purchase.",4
"Apple iPhone 6 A1549 AT&T Cellphone, 16GB, Gold",Apple,489.99,4,over all good condition. work great,0
"Apple iPhone 6 A1549 AT&T Cellphone, 16GB, Gold",Apple,489.99,1,Mine was not for AT&T as it would not take my AT&T SIM card.,1
"Apple iPhone 6 A1549 AT&T Cellphone, 16GB, Gold",Apple,489.99,5,Great phone! Absolutely happy with my purchase!,0
"Apple iPhone 6 A1549 AT&T Cellphone, 16GB, Gold",Apple,489.99,1,"0 stars.Its a locked phone.We were unable to activate it, as it's still attached to another plan.I will be returning this phone for a full refund.Disappointed,Andrea Sommer",7
"Apple iPhone 6 A1549 AT&T Cellphone, 16GB, Gold",Apple,489.99,1,I have had this phone for a day. A DAY. It turns itself off and won't turn back on for hours. Pretty useless. I would not recommend this product to anyone.,6
"Apple iPhone 6 A1549 AT&T Cellphone, 16GB, Gold",Apple,489.99,1,It was all chippy around the edges,3
"Apple iPhone 6 A1549 AT&T Cellphone, 16GB, Gold",Apple,489.99,1,Found that the screen was cracked after I received the package and opened it. Packaging was good. Must be damage before shipping.,2
"Apple iPhone 6 A1549 AT&T Cellphone, 16GB, Gold",Apple,489.99,5,I got it for my daughter and she good it thanks so much a very good price,1
"Apple iPhone 6 A1549 AT&T Cellphone, 16GB, Gold",Apple,489.99,1,Fake. Chinese knockoff. Not a real IPhone,0
"Apple iPhone 6 A1549 AT&T Cellphone, 16GB, Gold",Apple,489.99,5,"I purchased 3 IPhone 6s for 3 grandchildren, & everyone was completely satisfied",0
"Apple iPhone 6 A1549 AT&T Cellphone, 16GB, Gold",Apple,489.99,5,Returned unopened- no longer needed,0
"Apple iPhone 6 A1549 AT&T Cellphone, 16GB, Gold",Apple,489.99,1,"too much hurt on the bottom, very upset.",2
"Apple iPhone 6 A1549 AT&T Cellphone, 16GB, Gold",Apple,489.99,5,"Solid product, easy to assemble.",0
"Apple iPhone 6 A1549 AT&T Cellphone, 16GB, Gold",Apple,489.99,5,Phone came quickly. Phone works perfectly.😄,0
"Apple iPhone 6 A1549 AT&T Cellphone, 16GB, Gold",Apple,489.99,5,Very nice!,0
"Apple iPhone 6 A1549 AT&T Cellphone, 16GB, Gold",Apple,489.99,5,Great worth every penny!,0
"Apple iPhone 6 A1549 AT&T Cellphone, 16GB, Gold",Apple,489.99,4,Phone sounds much more tinny than previous iPhones. Otherwise everything else is great.,0
"Apple iPhone 6 A1549 AT&T Cellphone, 16GB, Gold",Apple,489.99,5,Finally i got my phone ，It's in very good condition.,0
"Apple iPhone 6 A1549 AT&T Cellphone, 16GB, Gold",Apple,489.99,5,Amazing! It actually came the next day with Prime. I was skeptical at first because so many people said they had various issues with the product. None so far! Highly recommend! Definitely an upgrade from my iPhone 5c!,0
"Apple iPhone 6 A1549 AT&T Cellphone, 16GB, Gold",Apple,489.99,1,Phone does not work! Will not connect to a network! VERY UNHAPPY!!!!!!!,1
"Apple iPhone 6 A1549 AT&T Cellphone, 16GB, Gold",Apple,489.99,4,"The item appeared to be slightly used, re-packaged and not brand new in box as advertised. Box was not sealed but had been opened and SIM card had been installed but nevertheless acceptable.",0
"Apple iPhone 6 A1549 AT&T Cellphone, 16GB, Gold",Apple,489.99,4,"I ordered the phone brand new & it appears to me that is exactly what I got, it works without any issues, came exactly as described, with the charger & brand new headphones!!! The box was complete with everything you get when you buy from the actual store!!!",0
"Apple iPhone 6 A1549 AT&T Cellphone, 16GB, Gold",Apple,489.99,5,Good buy. Works well no complaints,0
"Apple iPhone 6 A1549 AT&T Cellphone, 16GB, Gold",Apple,489.99,5,"Absolutely perfect condition, and 100% perfect functionality. Just wish I could get another one at this great price in the pink :)",0
"Apple iPhone 6 A1549 AT&T Cellphone, 16GB, Gold",Apple,489.99,5,Exactly as represented in excellent condition,2
"Apple iPhone 6 A1549 AT&T Cellphone, 16GB, Gold",Apple,489.99,5,Perfect. New in an unopened shrink wrapped box,0
"Apple iPhone 6 A1549 AT&T Cellphone, 16GB, Gold",Apple,489.99,5,Haven't had any issues yet and it's been 6 months.,0
"Apple iPhone 6 A1549 AT&T Cellphone, 16GB, Gold",Apple,489.99,1,"Huge issue with this order, the phone I received is stolen. It worked fine oversees, but once I got back and inserted a us sim, the phone get locked, it is registered to a stolen phone in US, I am also writing to amazon regarding this issue.",14
"Apple iPhone 6 A1549 AT&T Cellphone, 16GB, Gold",Apple,489.99,5,Amazing product! Cams early!,0
"Apple iPhone 6 A1549 AT&T Cellphone, 16GB, Gold",Apple,489.99,2,I couldn't hear good on the phone,0
"Apple iPhone 6 A1549 AT&T Cellphone, 16GB, Gold",Apple,489.99,5,One month in and i have had no issues whatsoever with the phone. It came in perfect working order and has maintained that order.,0
"Apple iPhone 6 A1549 AT&T Cellphone, 16GB, Gold",Apple,489.99,2,"The phone I bought isn't an AT&T phone. The SIM card from AT&T didn't work, the rep at the store said he doesn't know who the carrier is, but it's not them. Returning it.",0
"Apple iPhone 6 A1549 AT&T Cellphone, 16GB, Gold",Apple,489.99,5,Excellent product....very satisfied with seller....delivered in very timely matter....thank you!,0
"Apple iPhone 6 A1549 AT&T Cellphone, 16GB, Gold",Apple,489.99,4,Phone was in excellent physical condition,1
"Apple iPhone 6 A1549 AT&T Cellphone, 16GB, Gold",Apple,489.99,1,"BEWARE! THIS PHONE IS A FORGERY, AND NOT MADE WITH APPLE PRODUCTS!! I bought this iPhone for my daughter as a birthday gift to replace her broken phone IN May. Last week, the battery got too hot and it melted the screen. She took it to Apple to repair, and Apple told the parts were not APPLE PRODUCTS AND THAT IT IS A FORGERY AND THEY WILL NOT SUPPORT OR FIX IT. She had to buy a new phone.HAD I KNOWN THAT THIS WAS A FORGERY, I WOULD HAVE NOT BOUGHT IT. I WAS CHEATED.",8
"Apple iPhone 6 A1549 AT&T Cellphone, 16GB, Gold",Apple,489.99,5,"Ordered several months ago, saved some money and got a good phone",2
"Apple iPhone 6 A1549 AT&T Cellphone, 16GB, Gold",Apple,489.99,5,It is an amazing phone and the seller provided excellent service.,0
"Apple iPhone 6 A1549 AT&T Cellphone, 16GB, Gold",Apple,489.99,2,Cosmetically flawed on the home screen. Lots of scratches. Biggest issue is the battery status of the iPhone I received. I am very disappointed that the phone was shipped with a battery that seems faulty. It constantly jumps around and dies extremely fast. I may end up purchasing a new battery for the phone.,7
"Apple iPhone 6 A1549 AT&T Cellphone, 16GB, Gold",Apple,489.99,5,Item arrived quickly and was described in a nice apple package. The phone is in great working order.,0
"Apple iPhone 6 A1549 AT&T Cellphone, 16GB, Gold",Apple,489.99,5,"I purchased mine from seller JD Auction Warehouse. Item was better than described. Works perfectly. It was shipped same day and arrived earlier than expected. I am extremely pleased with my purchase. It is the AT&T model, but it is unlocked. Extremely pleased with my purchase.",4
"Apple iPhone 6 A1549 AT&T Cellphone, 16GB, Gold",Apple,489.99,4,over all good condition. work great,0
"Apple iPhone 6 A1549 AT&T Cellphone, 16GB, Gold",Apple,489.99,1,Mine was not for AT&T as it would not take my AT&T SIM card.,1
"Apple iPhone 6 A1549 AT&T Cellphone, 16GB, Gold",Apple,489.99,5,Great phone! Absolutely happy with my purchase!,0
"Apple iPhone 6 A1549 AT&T Cellphone, 16GB, Gold",Apple,489.99,1,"0 stars.Its a locked phone.We were unable to activate it, as it's still attached to another plan.I will be returning this phone for a full refund.Disappointed,Andrea Sommer",6
"Apple iPhone 6 A1549 AT&T Cellphone, 16GB, Gold",Apple,489.99,1,I have had this phone for a day. A DAY. It turns itself off and won't turn back on for hours. Pretty useless. I would not recommend this product to anyone.,6
"Apple iPhone 6 A1549 AT&T Cellphone, 16GB, Gold",Apple,489.99,1,It was all chippy around the edges,3
"Apple iPhone 6 A1549 AT&T Cellphone, 16GB, Gold",Apple,489.99,1,Found that the screen was cracked after I received the package and opened it. Packaging was good. Must be damage before shipping.,2
"Apple iPhone 6 A1549 AT&T Cellphone, 16GB, Gold",Apple,489.99,5,"Great phone, I love it!!",0
"Apple iPhone 6 A1549 AT&T Cellphone, 16GB, Gold",Apple,489.99,4,Product works great unfortunately several areas in the design were limited such as water / bean capacity,0
"Apple iPhone 6 A1549 AT&T Cellphone, 16GB, Gold",Apple,489.99,5,"I absolutely love this phone. I've had the same iPhone 5 since December 2014 and it was in pitiful shape, dropped way too many times... this iPhone 6 is like going from eating hamburger to steak! Haha",0
"Apple iPhone 6 A1549 AT&T Cellphone, 16GB, Gold",Apple,489.99,5,"Awesome deal, great phone, great price, quick delivery. Thank you.",0
"Apple iPhone 6 A1549 AT&T Cellphone, 16GB, Gold",Apple,489.99,4,"The product would have been fine, but it was not fully functional. I had to return it in the end. The return process was very easy and refund/exchange was offered with the utmost courtesy.",0
