Product Name,Brand Name,Price,Rating,Reviews,Review Votes
"Apple iPhone 6, Silver, 128 GB (Sprint)",Apple,699.99,5,Great quality phone. It was like new when it arrived and no problems with the phone at all.,0
"Apple iPhone 6, Silver, 128 GB (Sprint)",Apple,699.99,5,"fast shipping, the charger didn't work so she sent me a new one plus a gift card. greatly appreciated. wonderful to work with",1
"Apple iPhone 6, Silver, 128 GB (Sprint)",Apple,699.99,5,Great phone!,0
"Apple iPhone 6, Silver, 128 GB (Sprint)",Apple,699.99,1,"I purchased this phone from an unlocked phone classification under.. but the seller did not indicate the phone is locked in relevant page.it can not be use under other networks,,",63
"Apple iPhone 6, Silver, 128 GB (Sprint)",Apple,699.99,1,The phone was in perfect condition went to activate the phone it was good went to use one of my old phones then called sprint like two months later they said the phone was reported stolen and I need to return it . So now I have a phone I will not be able to use ever again !!!!,0
"Apple iPhone 6, Silver, 128 GB (Sprint)",Apple,699.99,3,I would have liked but I could not enjoy because it was not compatible with my att but thanks anyway,0
"Apple iPhone 6, Silver, 128 GB (Sprint)",Apple,699.99,5,I got my phone today & I love it. Practically new phone. I was an android user and iPhone 6 was a great change for me. Thanks!,1
"Apple iPhone 6, Silver, 128 GB (Sprint)",Apple,699.99,5,I purchase the phone for my grandbaby and she love it,1
"Apple iPhone 6, Silver, 128 GB (Sprint)",Apple,699.99,5,"The iphone 6 is great. Better deal to by from Amazon then get service, vs. getting trapped in a contract. I have the $50 plan with sprint and that's it!",10
"Apple iPhone 6, Silver, 128 GB (Sprint)",Apple,699.99,5,Excellent product in perfect state,0
"Apple iPhone 6, Silver, 128 GB (Sprint)",Apple,699.99,5,Perfect condition threesomes search on the corner lol,1
"Apple iPhone 6, Silver, 128 GB (Sprint)",Apple,699.99,5,"Great phone, holds lots of memory. Just mad I didn't know that sprint phones can not be unlocked so I had to open an account with sprint, but in all honesty, I like sprint service better than what I originally had.",1
"Apple iPhone 6, Silver, 128 GB (Sprint)",Apple,699.99,5,"Works as expected,.. a bit expensive",1
"Apple iPhone 6, Silver, 128 GB (Sprint)",Apple,699.99,2,I rated this two stars only because when I received the phone it didn't meet the description. Buts its not a 0 because the seller was very understanding and I got my money back right away!,1
"Apple iPhone 6, Silver, 128 GB (Sprint)",Apple,699.99,5,Came on time and everything works great! Thank you,1
"Apple iPhone 6, Silver, 128 GB (Sprint)",Apple,699.99,5,Thank you so much!,0
"Apple iPhone 6, Silver, 128 GB (Sprint)",Apple,699.99,5,Had a little more wear on the sides than I would like but since it is going into a mophie case it looks great.,1
"Apple iPhone 6, Silver, 128 GB (Sprint)",Apple,699.99,5,"so far its been working great! the only thing is, im not sure if they replaced the screen beause the circle around the front camera is not perfectly set, so it looks like its cutting into the view but so far the camera has been working fine! overall very happy with this purchase!",3
"Apple iPhone 6, Silver, 128 GB (Sprint)",Apple,699.99,4,"Did not come with SIM card, also the accessories were not authentic from Apple. And took (4-5 days to arrive). Overall, phone was in like-new condition. But the rear camera does not function.",0
"Apple iPhone 6, Silver, 128 GB (Sprint)",Apple,699.99,5,So in love with my iphone 6!,0
"Apple iPhone 6, Silver, 128 GB (Sprint)",Apple,699.99,4,Phone works fine. Works with boost mobile as well. Very easy transition.,3
"Apple iPhone 6, Silver, 128 GB (Sprint)",Apple,699.99,1,Phone was in excellent shape! Unfortunately it had been reported as stolen and could not be activated so it was useless!,0
"Apple iPhone 6, Silver, 128 GB (Sprint)",Apple,699.99,1,Stopped charging with a cable and that costs $300 to repair.,0
"Apple iPhone 6, Silver, 128 GB (Sprint)",Apple,699.99,5,A++,1
"Apple iPhone 6, Silver, 128 GB (Sprint)",Apple,699.99,5,iPhone 6 is a solid phone that is simplistic with the operating system. I like the thinner design and power button on the side. A good product from Apple.,1
"Apple iPhone 6, Silver, 128 GB (Sprint)",Apple,699.99,5,"Phone was as described, I LOVED the courtesy card inside saying to feel free to contact him if anything is wrong which I found pretty awesome! All in all Great!",0
"Apple iPhone 6, Silver, 128 GB (Sprint)",Apple,699.99,5,Awesome,0
"Apple iPhone 6, Silver, 128 GB (Sprint)",Apple,699.99,5,I bought this used a year ago but my iphone 6 is still going strong. It was a very good used machine. After purchase care was also great.,0
"Apple iPhone 6, Silver, 128 GB (Sprint)",Apple,699.99,5,This is the best Iphone I have ever purchased. I'm very pleased,0
"Apple iPhone 6, Silver, 128 GB (Sprint)",Apple,699.99,5,It's a beautiful color the Space Gray and just as they advertise in the picture it was shipped immediately and the customer service was excellent. I will purchase again from them package got here in three days I activated the phone immediately and it works perfect I rate it a 5 I'm very happy.,1
"Apple iPhone 6, Silver, 128 GB (Sprint)",Apple,699.99,5,"Great seller, thanks for the phone!",0
"Apple iPhone 6, Silver, 128 GB (Sprint)",Apple,699.99,1,Cracked screen also finger print home botton never work bad quality product,0
"Apple iPhone 6, Silver, 128 GB (Sprint)",Apple,699.99,2,"When the phone states that it is UNLOCKED, that means it should work. But since this is with Sprint that can't be done. So therefore the phone is nothing but a big Ipod and useless. Let buys be ware, When Iphones are purchased through Sprint they can't be transferred to another service. This sucks as you can never get out or away from Sprint. Hook line and sunk - you are stuck",1
"Apple iPhone 6, Silver, 128 GB (Sprint)",Apple,699.99,4,"It was nice, going on the web and downloading apps was smooth and fast. Nice phone.",0
"Apple iPhone 6, Silver, 128 GB (Sprint)",Apple,699.99,1,Didnt work,0
"Apple iPhone 6, Silver, 128 GB (Sprint)",Apple,699.99,4,Phone is just what I expected and in good condition.,1
"Apple iPhone 6, Silver, 128 GB (Sprint)",Apple,699.99,5,Phone was great!!,0
"Apple iPhone 6, Silver, 128 GB (Sprint)",Apple,699.99,5,My iPhone that I ordered from Amazon worked great. I had no issues with turning it on or getting it activated. Came unscathed with charging equipment. I am highly satisfied and love my phone!,0
"Apple iPhone 6, Silver, 128 GB (Sprint)",Apple,699.99,5,Love it,0
"Apple iPhone 6, Silver, 128 GB (Sprint)",Apple,699.99,1,"Im Very diasppointed , I'm having problems to unlock this phone .",0
"Apple iPhone 6, Silver, 128 GB (Sprint)",Apple,699.99,5,Love the phone],0
"Apple iPhone 6, Silver, 128 GB (Sprint)",Apple,699.99,5,Very satisfied. Came earlier than expected,0
"Apple iPhone 6, Silver, 128 GB (Sprint)",Apple,699.99,1,It's not straight talk and we thought it was,0
"Apple iPhone 6, Silver, 128 GB (Sprint)",Apple,699.99,5,Excellent,1
"Apple iPhone 6, Silver, 128 GB (Sprint)",Apple,699.99,1,I bought this phone that clear stated that its compatible with sprint only to call sprint and for them to tell me that's not the case. Such a waste of time!!,3
"Apple iPhone 6, Silver, 128 GB (Sprint)",Apple,699.99,1,I can't put The sim ! Because the phone has been reported lost so it can't be activated!And I try to write to my seller she didn't answer me !,27
"Apple iPhone 6, Silver, 128 GB (Sprint)",Apple,699.99,5,Very great overall,0
"Apple iPhone 6, Silver, 128 GB (Sprint)",Apple,699.99,4,Delivered ahead of schedule and in mint condition. Only issue was some charge cables did not seat properly and intermittently charged. We have been able to correct so it's working great!,0
"Apple iPhone 6, Silver, 128 GB (Sprint)",Apple,699.99,5,"Not a fan of buying refurbished stuff, but this was in great condition and works flawless.",2
"Apple iPhone 6, Silver, 128 GB (Sprint)",Apple,699.99,5,Perfect and flawless!!! Ready to use!! Quick delivery!!! Very pleased!!!,1
"Apple iPhone 6, Silver, 128 GB (Sprint)",Apple,699.99,5,"Needs no explanations, simply good",0
"Apple iPhone 6, Silver, 128 GB (Sprint)",Apple,699.99,5,Exellent.!! It s a great cell i like my iphone works perfect l am very happy to buy it,1
"Apple iPhone 6, Silver, 128 GB (Sprint)",Apple,699.99,1,Very bad,2
"Apple iPhone 6, Silver, 128 GB (Sprint)",Apple,699.99,5,I love it. It's everything I've wanted. Everything I neeeeedddd! Talk about it I'd go on and on and onnnnn....it's everything to me!,1
"Apple iPhone 6, Silver, 128 GB (Sprint)",Apple,699.99,4,Great phone! I like the fact that Apple has allowed a little more freedom to customize.,0
"Apple iPhone 6, Silver, 128 GB (Sprint)",Apple,699.99,5,very god,0
"Apple iPhone 6, Silver, 128 GB (Sprint)",Apple,699.99,5,"Great , charger was broken when it got here but phone was perfect !",1
"Apple iPhone 6, Silver, 128 GB (Sprint)",Apple,699.99,4,"I have had zero problems with the phone itself. I love Apple products and so far it stands up to any other I have had. The phone arrived sooner than expected, so as for the iPhone 6 it is a great device.",0
"Apple iPhone 6, Silver, 128 GB (Sprint)",Apple,699.99,5,Love love love my iPhone 6,0
"Apple iPhone 6, Silver, 128 GB (Sprint)",Apple,699.99,5,as advertised! thanks,0
"Apple iPhone 6, Silver, 128 GB (Sprint)",Apple,699.99,5,It very good phone,2
"Apple iPhone 6, Silver, 128 GB (Sprint)",Apple,699.99,5,Received in great condition and shape,7
"Apple iPhone 6, Silver, 128 GB (Sprint)",Apple,699.99,5,Gucci,1
"Apple iPhone 6, Silver, 128 GB (Sprint)",Apple,699.99,5,Works great. I would buy from this buyer again.,1
"Apple iPhone 6, Silver, 128 GB (Sprint)",Apple,699.99,4,Worked great! Had to take it to sprint first to activate but that was free of charge! Came with a few small scratches on the back aluminum but that was barely noticable as well as it was used so that's understandable.,0
"Apple iPhone 6, Silver, 128 GB (Sprint)",Apple,699.99,5,"Came early, was what it was supposed to be and works great. Cheaper than any stores out there!",1
"Apple iPhone 6, Silver, 128 GB (Sprint)",Apple,699.99,5,It us for another person but I know they are good,1
"Apple iPhone 6, Silver, 128 GB (Sprint)",Apple,699.99,5,the best,0
"Apple iPhone 6, Silver, 128 GB (Sprint)",Apple,699.99,4,Purchased for daughter and she is very pleased with it. good price and arrived in a timely manner.,0
"Apple iPhone 6, Silver, 128 GB (Sprint)",Apple,699.99,3,"I was very excited to receive this in the mail and it came earlier than the estimated arrival date. An extra charger was also included, free of charge. Unfortunately, when I was trying to activate the phone, I was informed that the SIM card was still linked to another person's account so I had to go to the Apple store to get a replacement in order for the phone to work. Overall, I love the phone but didn't like how I had to do extra steps to get it to work.",3
"Apple iPhone 6, Silver, 128 GB (Sprint)",Apple,699.99,5,Beautiful phone & worked efficiently,1
"Apple iPhone 6, Silver, 128 GB (Sprint)",Apple,699.99,5,Quaily phone for cheap prive,1
"Apple iPhone 6, Silver, 128 GB (Sprint)",Apple,699.99,5,It was unlocked and exactly as described. I was surprised at how quickly it started to work.,0
"Apple iPhone 6, Silver, 128 GB (Sprint)",Apple,699.99,4,I have minor problems with the phone. But other than that I love it. Came with charger and headphones wasn't locked. I needed a SIM card and that's it. I'm satisfied.,0
"Apple iPhone 6, Silver, 128 GB (Sprint)",Apple,699.99,1,It's not really good,0
"Apple iPhone 6, Silver, 128 GB (Sprint)",Apple,699.99,1,Came to me broken and unable for sprint to activate. If I could give this 0 stars I would. Not only was it incredibly frustrating but took two hours for sprint to trouble shoot it only to find out the couldn't fix it. Wasted my time and money.,0
"Apple iPhone 6, Silver, 128 GB (Sprint)",Apple,699.99,5,Great customer service and support. Phone looks and works great. I activated my new phone with ease. It took 10 minutes.Very impressed with overall purchase!!!!,0
"Apple iPhone 6, Silver, 128 GB (Sprint)",Apple,699.99,1,"After 1 year of using, the screen turn grey not respond .",0
"Apple iPhone 6, Silver, 128 GB (Sprint)",Apple,699.99,5,"Works great, just as described. Sender usps, not my favorite but it got here.",0
"Apple iPhone 6, Silver, 128 GB (Sprint)",Apple,699.99,5,Great! Works like new,0
"Apple iPhone 6, Silver, 128 GB (Sprint)",Apple,699.99,4,Phone was in good condition but the battery lost its charge quickly.,1
"Apple iPhone 6, Silver, 128 GB (Sprint)",Apple,699.99,5,Good phone and a pleasure to do business with this company.,0
"Apple iPhone 6, Silver, 128 GB (Sprint)",Apple,699.99,5,Great phone,0
"Apple iPhone 6, Silver, 128 GB (Sprint)",Apple,699.99,1,Unbelievable!!! Received phone and the previous owner never released it - SPRINT can't set it up for us and keeps getting an error message because of it.,1
"Apple iPhone 6, Silver, 128 GB (Sprint)",Apple,699.99,5,Totally functional and looks like new... Had a problem with the battery at first though but I fixed it.,0
"Apple iPhone 6, Silver, 128 GB (Sprint)",Apple,699.99,5,"Met my expectations and works perfectly fine. No scratches, chips, ect",0
"Apple iPhone 6, Silver, 128 GB (Sprint)",Apple,699.99,3,Phone had damage.,0
"Apple iPhone 6, Silver, 128 GB (Sprint)",Apple,699.99,2,"The phone was fine, just that I couldn't connect it to Sprint. Waste of time.",1
"Apple iPhone 6, Silver, 128 GB (Sprint)",Apple,699.99,3,"Phone worked great , but didn't include anything listed in the description.",1
"Apple iPhone 6, Silver, 128 GB (Sprint)",Apple,699.99,4,The phone was in great condition but locked to sprint and impossible to unlock the carrier which is disappointing.,0
"Apple iPhone 6, Silver, 128 GB (Sprint)",Apple,699.99,1,i can't unlock this phone.....,2
"Apple iPhone 6, Silver, 128 GB (Sprint)",Apple,699.99,1,This phone was not unlocked and Sprint employees could not get it working. Very disappointing!,1
"Apple iPhone 6, Silver, 128 GB (Sprint)",Apple,699.99,3,"The phone I received was in great condition except for one small scratch in the upper corner. However, the phone was locked to the original user's Apple ID so there is no way for me to access this phone.I was satisfied with the condition but very disappointed that Amazon did not wipe the phone entirely and therefore I could not use it at all. I researched buying a phone from Amazon and thought that it would be safe. Just a word of caution that this does happen sometimes!",3
"Apple iPhone 6, Silver, 128 GB (Sprint)",Apple,699.99,5,"I purchased two iPhone 6. They arrived quickly and in good condition. No chargers, but the price and color was just right.",0
"Apple iPhone 6, Silver, 128 GB (Sprint)",Apple,699.99,1,I tried activating to my sprint account & they informed me that it could not be activated,0
"Apple iPhone 6, Silver, 128 GB (Sprint)",Apple,699.99,5,I love it !,0
"Apple iPhone 6, Silver, 128 GB (Sprint)",Apple,699.99,5,Like,0
"Apple iPhone 6, Silver, 128 GB (Sprint)",Apple,699.99,5,This iPhone 6 has been nothing but great to me! It was in the exact condition that the description said it was I feel like I paid s great price for a new iPhone 6! Thank you! It's getting taken care of!,0
"Apple iPhone 6, Silver, 128 GB (Sprint)",Apple,699.99,5,I bought this for my girlfriend's birthday! Works great and she loves it a lot!,0
"Apple iPhone 6, Silver, 128 GB (Sprint)",Apple,699.99,5,Works great! Bought it used and had no problems whatsoever. Very happy!,0
"Apple iPhone 6, Silver, 128 GB (Sprint)",Apple,699.99,5,Excellent!,0
"Apple iPhone 6, Silver, 128 GB (Sprint)",Apple,699.99,2,No charger,0
"Apple iPhone 6, Silver, 128 GB (Sprint)",Apple,699.99,5,"Phone came in early , everything was just as it was said on the page. I'm very pleased with my new phone thank you . I recommend buying",0
"Apple iPhone 6, Silver, 128 GB (Sprint)",Apple,699.99,5,My fiance loves his new phone!! The price was excellent and it was in perfect condition!!,0
"Apple iPhone 6, Silver, 128 GB (Sprint)",Apple,699.99,1,Idk,0
"Apple iPhone 6, Silver, 128 GB (Sprint)",Apple,699.99,1,Phone is with Sprint Prepaid,2
"Apple iPhone 6, Silver, 128 GB (Sprint)",Apple,699.99,5,"Phone came just as described, I'm impressed!",0
"Apple iPhone 6, Silver, 128 GB (Sprint)",Apple,699.99,5,Best iPhone ever.,0
"Apple iPhone 6, Silver, 128 GB (Sprint)",Apple,699.99,5,Excellent,0
"Apple iPhone 6, Silver, 128 GB (Sprint)",Apple,699.99,5,Got it in really great condition.,0
"Apple iPhone 6, Silver, 128 GB (Sprint)",Apple,699.99,5,Coolest phone ever,0
"Apple iPhone 6, Silver, 128 GB (Sprint)",Apple,699.99,5,Thank you,0
"Apple iPhone 6, Silver, 128 GB (Sprint)",Apple,699.99,5,Returned but bought iPhone 6 Plus,0
"Apple iPhone 6, Silver, 128 GB (Sprint)",Apple,699.99,1,"First off, why the HELL DID THIS NOT COME WITH A CHARGER?!!?!!? HELLO!!!!! IF I WANTED TO BUY THIS PHONE I WOULD WANT A CHARGER YOU IDIOT",0
"Apple iPhone 6, Silver, 128 GB (Sprint)",Apple,699.99,5,"Nothing was wrong with the phone besides tiny little scratches, but its not a big deal. The phone is working perfectly and thats all that matters 😊👍🏽",0
"Apple iPhone 6, Silver, 128 GB (Sprint)",Apple,699.99,5,Great phone,0
"Apple iPhone 6, Silver, 128 GB (Sprint)",Apple,699.99,5,"It was a gift, my grandson loved it!",0
"Apple iPhone 6, Silver, 128 GB (Sprint)",Apple,699.99,5,good product.....like it very much.,0
"Apple iPhone 6, Silver, 128 GB (Sprint)",Apple,699.99,5,My 16 year old grandson is very happy,0
"Apple iPhone 6, Silver, 128 GB (Sprint)",Apple,699.99,5,I received my phone very quickly and all my expectations were met.,1
"Apple iPhone 6, Silver, 128 GB (Sprint)",Apple,699.99,5,Good product,0
"Apple iPhone 6, Silver, 128 GB (Sprint)",Apple,699.99,2,"it's locked to sprint, which is not clearly described.",0
"Apple iPhone 6, Silver, 128 GB (Verizon)",Apple,399,5,Awesome product & awesome service. A++++,1
"Apple iPhone 6, Silver, 128 GB (Verizon)",Apple,399,3,got shipped to me right away and worked well but it had a lot of scratches on front glass screen part and a lot of chips around the edge of the phone. wish he would've been more straight up with me about the shape of the phone.,1
"Apple iPhone 6, Silver, 128 GB (Verizon)",Apple,399,5,Delivery was fast and came with a charger and a car port as well. Awesome!,0
"Apple iPhone 6, Silver, 128 GB (Verizon)",Apple,399,5,"Got this as a gift for someone. They love love love it! And the camera on these is unbelievable (as a DSLR semi-pro, i don't say that lightly)",0
"Apple iPhone 6, Silver, 128 GB (Verizon)",Apple,399,5,"Although I had some rough patches when I received my phone, the seller worked with me and everything is fine now. Thank you for my new iPhone 6.",1
"Apple iPhone 6, Silver, 128 GB (Verizon)",Apple,399,5,This is the best company that I've ever bought from.,1
"Apple iPhone 6, Silver, 128 GB (Verizon)",Apple,399,1,"It does not work right, said it was in good condition and the screen won't let me type and the verizon people said it didn't work at all.",1
"Apple iPhone 6, Silver, 128 GB (Verizon)",Apple,399,5,Great looks like brand awesome phone everything seller said it was,0
"Apple iPhone 6, Silver, 128 GB (Verizon)",Apple,399,5,"The phone is everything I thought it would be. I bought this used and was worried, but it came in beautiful condition. Got to buy your storage in advance with Apple products, and 64 gb should be good for the time I'll be using this phone.",3
"Apple iPhone 6, Silver, 128 GB (Verizon)",Apple,399,5,Great phone,0
"Apple iPhone 6, Silver, 128 GB (Verizon)",Apple,399,5,This is the first iPhone I have had so far it is great.,1
"Apple iPhone 6, Silver, 128 GB (Verizon)",Apple,399,1,Waste of money. Very frustrating. When I spend more than the equivalent a truck payment on a phone I expect it to activate. Hopefully the return goes better.,1
"Apple iPhone 6, Silver, 128 GB (Verizon)",Apple,399,5,Very Good,0
"Apple iPhone 6, Silver, 128 GB (Verizon)",Apple,399,1,This is the first negative review I have ever written. The phone was expensive and when it arrived not only was it so scratched up on the screen (definitely not normal wear and tear) but the phone did not work! Callers could not hear me. Very frustrating experience and first time I had a bad experience ordering through Amazon.,17
"Apple iPhone 6, Silver, 128 GB (Verizon)",Apple,399,5,Product description far exceeded expectation,0
"Apple iPhone 6, Silver, 128 GB (Verizon)",Apple,399,5,Shipping was quick and even came two days early! Item was exactly as described. Thanks!,1
"Apple iPhone 6, Silver, 128 GB (Verizon)",Apple,399,5,"The phone shipped in 2 days, 5 days sooner than expected! Great service and nice phone. Thank you!",1
"Apple iPhone 6, Silver, 128 GB (Verizon)",Apple,399,1,"The specific one I got had minor defects that made the phone unusable, I recommend proceeding with extra caution buying used iPhones",2
"Apple iPhone 6, Silver, 128 GB (Verizon)",Apple,399,5,Went great,1
"Apple iPhone 6, Silver, 128 GB (Verizon)",Apple,399,4,"Works as expected since I bought it several months ago. As everyone knows, it is bigger (but thinner) than the iPhone 5. Took it to Verizon and got it hooked up to our network without incident. Saved about $200 doing it this way (with a refurbished phone).",0
"Apple iPhone 6, Silver, 128 GB (Verizon)",Apple,399,4,Everything was right but they give me some cheap headphones,0
"Apple iPhone 6, Silver, 128 GB (Verizon)",Apple,399,3,"Ordered the silver one with a white front and was sent the black space grey one I actually was trying to avoid while searching for an iPhone 6. The phone works great though so I can't complain too much, just wish I would've gotten the color I wanted",0
"Apple iPhone 6, Silver, 128 GB (Verizon)",Apple,399,1,"Despite claiming the product only has minor cosmetic defects possibly and has been tested by professional technicians, the front camera does not work. I am disappointed that this product was able to pass any seller or professional's quality standards as a properly refurbished product. Not only does this cause me a significant inconvenience in that I will have to find a way to return it, but I will also have to be without a working phone when I am waiting for calls regarding important personal commitments.",6
"Apple iPhone 6, Silver, 128 GB (Verizon)",Apple,399,5,"I really love this phone ,though it was going t be too big but not really that bad.I had been using 4s and really liked how I could fit it into a fron pocket ,but after waiting too long decided to go with this size iPhone and try it out.Battery life is excellent and the bigger screen is worth carrying around the size.So here s so helpful information (I bought a used one ),the phone is unlocked as a modelA1549 ,no matter if the person who brought it from Verizon leased or bought it out right.That is just how Verizon does it ,there is only one USA model A1549 ,I am not sure if a GSM seller such as t-mobile just deactivated the CDMA capabities or the firmware doesn't have them.So I knew this and bought it to use on T-mobile (actually this is better that a GSM only phone because you can sell it to anyone once you are done with it),the Hotspot feature and WiFi calling both work ,just search wifi calling after you put in your SIM card .Then the first time you use the phone it will ask you to confirm your 911 address ,then you just turn it on and off .Okay now to the great part ,I took a chance on Warehouse deals and it paid off.If you look at a phone for sale by AWD,you will notice just a condition is given (all description as other warehouse deals).The lowest deal ""acceptable ""means this for sure no original box ,no charger and no earbuds.The ""good ""means maybe one of those things is included but not all.The ""very good ""means everything but original box and condition must match (signs of wear but no dents,not many marks or scratches) and like new means just that looks new with everything original.Now if you go for the lowest condition as I did ,you can receive a ""like new looking phone"" with nothing else or a slightly beat up one with scratches on glass.And you can receive any condition in between just no extras.When I ordered the phone ,it stated that it would take a while to get it (AWD doesn't always have the phone ready ,just one matching the description from whoever they bought it from),so basically they uses the lowest ""acceptable "" as a hedge against someone complaining.The phone I got was completely ""like new"" and they threw in a plastic bag with charger and earbuds,and the price was cheaper that any other seller on here by quite a bit also.Take a chance on AWD ,if you are unhappy you can return ,plus they have the best customer service.",1
"Apple iPhone 6, Silver, 128 GB (Verizon)",Apple,399,4,Good product and quick shipping. No complaints.,0
"Apple iPhone 6, Silver, 128 GB (Verizon)",Apple,399,5,absolutely love it!,0
"Apple iPhone 6, Silver, 128 GB (Verizon)",Apple,399,5,Great phone thank you,0
"Apple iPhone 6, Silver, 128 GB (Verizon)",Apple,399,5,Great All Around. Highly recommend this seller,0
"Apple iPhone 6, Silver, 128 GB (Verizon)",Apple,399,2,"The front flash make all my pictures black. If it wasnt for that, i would give it 5 stars because iPhones are the best. But that is just a seller issue, not a phone issue",0
"Apple iPhone 6, Silver, 128 GB (Verizon)",Apple,399,5,Everything is good tx,0
"Apple iPhone 6, Silver, 128 GB (Verizon)",Apple,399,5,The iPhone made it before Christmas. It was a great gift. Thanks for the great phone,0
