Product Name,Brand Name,Price,Rating,Reviews,Review Votes
Apple iPhone 6 128GB Silver AT&T,Apple,599.95,1,"PHONES GREAT BUT I PAID $600.00 N DIDN'T GET THE CHARGER THAT IS SUPPOSE TO COME WITH IT OR THE HEADPHONES. I CAN CARE LESS ABOUT THE HEADPHONES. BUT, HELLO HOW WAS I SUPPOSE TO CHARGE THE PHONE. I HAD TO GO OUT N PURCHASE A CHARGER WITCH BY THE WAY WAS ANOTHER $20.00. SO I COULD CHARGE MY PHONE THAT NIGHT. RIDICULOUS......",9
Apple iPhone 6 128GB Silver AT&T,Apple,599.95,3,"Hardware was in flawless form, but the software has been troubling me. I canthelp but think that the phone is slow although i have been very cautious with using it. It lags it glitches and im really disappiionted with this fact cause ive tried doing everthing. Overall i was satisfied and 3 stars would be fair",4
Apple iPhone 6 128GB Silver AT&T,Apple,599.95,5,Excelent seller help me a lot device as describe brand new,0
Apple iPhone 6 128GB Silver AT&T,Apple,599.95,5,great size,0
Apple iPhone 6 128GB Silver AT&T,Apple,599.95,5,Very satisfied with this product. Product was as described in the offer. Phone came quickly.,0
Apple iPhone 6 128GB Silver AT&T,Apple,599.95,5,came quick very reliable,0
Apple iPhone 6 128GB Silver AT&T,Apple,599.95,5,This phone was a great deal for the price. Arrived in pristine and excellent condition. Must be seen to appreciate. The phone was flawless and in complete working condition. It so nice dealing with a reputable company selling the exact item advertised. I am beyond satisfied at this point.,0
Apple iPhone 6 128GB Silver AT&T,Apple,599.95,5,Very good,0
Apple iPhone 6 128GB Silver AT&T,Apple,599.95,1,Iphone ilegal,0
Apple iPhone 6 128GB Silver AT&T,Apple,599.95,5,"I love my new I phone, All I had to do is put my SIM card in it and it works. I didn't have to call at and t or anything, I will be definitely doing business with this seller again",0
Apple iPhone 6 128GB Silver AT&T,Apple,599.95,1,Phone stopped working after a month. Can't return. Extremely angry. What a waste of money!,0
Apple iPhone 6 128GB Silver AT&T,Apple,599.95,5,It's great.,0
Apple iPhone 6 128GB Silver AT&T,Apple,599.95,5,Excellent experience!,0
Apple iPhone 6 128GB Silver AT&T,Apple,599.95,5,Good price and operates what an Iphone 6 is suppose to do,0
Apple iPhone 6 128GB Silver AT&T,Apple,599.95,2,Cosmetically flawed on the home screen. Lots of scratches. Biggest issue is the battery status of the iPhone I received. I am very disappointed that the phone was shipped with a battery that seems faulty. It constantly jumps around and dies extremely fast. I may end up purchasing a new battery for the phone.,7
Apple iPhone 6 128GB Silver AT&T,Apple,599.95,5,Item arrived quickly and was described in a nice apple package. The phone is in great working order.,0
Apple iPhone 6 128GB Silver AT&T,Apple,599.95,5,"I purchased mine from seller JD Auction Warehouse. Item was better than described. Works perfectly. It was shipped same day and arrived earlier than expected. I am extremely pleased with my purchase. It is the AT&T model, but it is unlocked. Extremely pleased with my purchase.",4
Apple iPhone 6 128GB Silver AT&T,Apple,599.95,4,over all good condition. work great,0
Apple iPhone 6 128GB Silver AT&T,Apple,599.95,1,Mine was not for AT&T as it would not take my AT&T SIM card.,1
Apple iPhone 6 128GB Silver AT&T,Apple,599.95,5,Great phone! Absolutely happy with my purchase!,0
Apple iPhone 6 128GB Silver AT&T,Apple,599.95,1,"0 stars.Its a locked phone.We were unable to activate it, as it's still attached to another plan.I will be returning this phone for a full refund.Disappointed,Andrea Sommer",7
Apple iPhone 6 128GB Silver AT&T,Apple,599.95,1,I have had this phone for a day. A DAY. It turns itself off and won't turn back on for hours. Pretty useless. I would not recommend this product to anyone.,6
Apple iPhone 6 128GB Silver AT&T,Apple,599.95,1,It was all chippy around the edges,3
Apple iPhone 6 128GB Silver AT&T,Apple,599.95,1,Found that the screen was cracked after I received the package and opened it. Packaging was good. Must be damage before shipping.,2
Apple iPhone 6 128GB Silver AT&T,Apple,599.95,2,"Having purchased what was advertised as a new iPhone i was pretty shocked when I opened the box and found a filthy, greasy mess. This phone was not new and had been handled by someone eating fried chicken or similar. The protective cover had been removed and poorly replaced complete with greasy fingerprints. Disgusting !",7
Apple iPhone 6 128GB Silver AT&T,Apple,599.95,5,good,0
Apple iPhone 6 128GB Silver AT&T,Apple,599.95,5,Product was just as described. I am very satisfied.,8
Apple iPhone 6 128GB Silver AT&T,Apple,599.95,5,PERFECT AND AWSOME,0
Apple iPhone 6 128GB Silver AT&T,Apple,599.95,5,Great phone,1
Apple iPhone 6 128GB Silver AT&T,Apple,599.95,5,Delivered as described!,1
Apple iPhone 6 128GB Silver AT&T,Apple,599.95,5,Great phone fast service,1
Apple iPhone 6 128GB Silver AT&T,Apple,599.95,5,"I love, love, love it! I remember seeing the product saying Used- Acceptable on its conditions, and it had me a little worried. When it came, I honestly feel like the condition should have been Used- Very Good. It was literally like a brand new out of the pack-type phone. I did, however, had my screen break the day I got it, but I don't hold this company accountable for that. Any who, the screen is now fixed, and the phone itself is everything I needed and more.",0
Apple iPhone 6 128GB Silver AT&T,Apple,599.95,5,"Bought this after visits to 2 Apple stores revealed that the stores cannot just sell you an iPhone outright (they want payments or a contract or some other undesirable). Such an experience is dumbfounding, indeed! THANK YOU Amazon for saving me from another disappointing visit to what Apple calls a ""store""!! Apple locations are prisons of torture followed by frustration that I cannot spend my money there. I hope to never set foot in one again. Too bad I like their products so much!!",1
Apple iPhone 6 128GB Silver AT&T,Apple,599.95,5,"J Lynch from MusicDealz is awesome, the phone seems to be in perfect condition. 100% recommended.Late in writing review as I was travelling.thanks",0
Apple iPhone 6 128GB Silver AT&T,Apple,599.95,5,It came with a dent in it. Should have said that in the description. But ill accept it. Thank you,0
Apple iPhone 6 128GB Silver AT&T,Apple,599.95,5,I love this phone but I traded it in at sprint and got the new iPhone 6s for $86!,1
Apple iPhone 6 128GB Silver AT&T,Apple,599.95,5,This seller is great! The first one had issues and they took it back without questions. My daughter loves this phone. She says it is like new. We didn't want to get into another contract and this was a perfect way to do it. Now if she can keep it out of the toilet we will be just fine!,3
Apple iPhone 6 128GB Silver AT&T,Apple,599.95,1,"I ordered this phone for my son for Christmas, so that I wouldn't have to pay AT&T's high price for a new phone through them, when it arrived, it would not hold a charge. So I ended up having to return this phone, which I had no issues with the seller over this. But it was so close to Christmas by this time that I had to get my son a phone through AT&T after all.",2
Apple iPhone 6 128GB Silver AT&T,Apple,599.95,5,"no headphones, no charger but looks and works PERFECT. definitely worth it.",0
Apple iPhone 6 128GB Silver AT&T,Apple,599.95,5,I got it for my daughter and she good it thanks so much a very good price,1
Apple iPhone 6 128GB Silver AT&T,Apple,599.95,1,Fake. Chinese knockoff. Not a real IPhone,0
Apple iPhone 6 128GB Silver AT&T,Apple,599.95,5,"I purchased 3 IPhone 6s for 3 grandchildren, & everyone was completely satisfied",0
Apple iPhone 6 128GB Silver AT&T,Apple,599.95,5,Returned unopened- no longer needed,0
Apple iPhone 6 128GB Silver AT&T,Apple,599.95,1,"too much hurt on the bottom, very upset.",2
Apple iPhone 6 128GB Silver AT&T,Apple,599.95,5,"Solid product, easy to assemble.",0
Apple iPhone 6 128GB Silver AT&T,Apple,599.95,5,Phone came quickly. Phone works perfectly.😄,0
Apple iPhone 6 128GB Silver AT&T,Apple,599.95,5,Very nice!,0
Apple iPhone 6 128GB Silver AT&T,Apple,599.95,5,Great worth every penny!,0
Apple iPhone 6 128GB Silver AT&T,Apple,599.95,4,Phone sounds much more tinny than previous iPhones. Otherwise everything else is great.,0
Apple iPhone 6 128GB Silver AT&T,Apple,599.95,5,She's loving it,0
Apple iPhone 6 128GB Silver AT&T,Apple,599.95,1,"I have to say that I'm very disappointed with this purchase. I received the phone and on the description it said it had minor cosmetic issues. When I received the phone, the phone actually had tremendous scratches on the main screen and a huge dent on the back. I wish I knew the cosmetic damage was more intense, I would've spent the extra $200 to get a brand-new phone. I'm not satisfied with this and I hope that the seller reads this and confine some happy medium with their customer.",10
Apple iPhone 6 128GB Silver AT&T,Apple,599.95,5,Could not be happier.,0
Apple iPhone 6 128GB Silver AT&T,Apple,599.95,1,When I looked it said there was nothing wrong. Everything was clean. After I got it. I checked the esn and it was bad. Was so mad,2
Apple iPhone 6 128GB Silver AT&T,Apple,599.95,5,Nice,0
Apple iPhone 6 128GB Silver AT&T,Apple,599.95,1,Sim card was not required and has icloud activation lock so i have no function on this phone at all,7
Apple iPhone 6 128GB Silver AT&T,Apple,599.95,4,Excellent,0
Apple iPhone 6 128GB Silver AT&T,Apple,599.95,4,Overall phone is in great condition. Works perfectly well. BUT a few days ago I noticed the screen was loose in the top left corner. It has been replaced and was done very poorly or it wouldn't be loose. Other than that it's PERFECT!,0
Apple iPhone 6 128GB Silver AT&T,Apple,599.95,5,I upgraded from the iPhone 5c & it was worth it. The iPhone 6 was in mint condition to be used.,0
Apple iPhone 6 128GB Silver AT&T,Apple,599.95,2,Phone came with a just a USB charging cord that did not work,0
Apple iPhone 6 128GB Silver AT&T,Apple,599.95,5,Finally i got my phone ，It's in very good condition.,0
Apple iPhone 6 128GB Silver AT&T,Apple,599.95,5,Amazing! It actually came the next day with Prime. I was skeptical at first because so many people said they had various issues with the product. None so far! Highly recommend! Definitely an upgrade from my iPhone 5c!,0
Apple iPhone 6 128GB Silver AT&T,Apple,599.95,1,Phone does not work! Will not connect to a network! VERY UNHAPPY!!!!!!!,1
Apple iPhone 6 128GB Silver AT&T,Apple,599.95,4,"The item appeared to be slightly used, re-packaged and not brand new in box as advertised. Box was not sealed but had been opened and SIM card had been installed but nevertheless acceptable.",0
Apple iPhone 6 128GB Silver AT&T,Apple,599.95,4,"I ordered the phone brand new & it appears to me that is exactly what I got, it works without any issues, came exactly as described, with the charger & brand new headphones!!! The box was complete with everything you get when you buy from the actual store!!!",0
Apple iPhone 6 128GB Silver AT&T,Apple,599.95,5,Good buy. Works well no complaints,0
Apple iPhone 6 128GB Silver AT&T,Apple,599.95,5,"Absolutely perfect condition, and 100% perfect functionality. Just wish I could get another one at this great price in the pink :)",0
Apple iPhone 6 128GB Silver AT&T,Apple,599.95,5,Exactly as represented in excellent condition,2
Apple iPhone 6 128GB Silver AT&T,Apple,599.95,5,Perfect. New in an unopened shrink wrapped box,0
Apple iPhone 6 128GB Silver AT&T,Apple,599.95,5,Haven't had any issues yet and it's been 6 months.,0
Apple iPhone 6 128GB Silver AT&T,Apple,599.95,1,Very disappointed.,36
Apple iPhone 6 128GB Silver AT&T,Apple,599.95,5,love it!,0
Apple iPhone 6 128GB Silver AT&T,Apple,599.95,5,Arrived in perfect condition.,0
Apple iPhone 6 128GB Silver AT&T,Apple,599.95,5,"Ocean Reef Electronics more than exceeded my expectations!!! I was extremely satisfied with my purchase. I could not distinguish my ""refurbished"" iPhone 6 from ""brand new"" ones my 3 brothers had purchased! (that is no exaggeration) The only difference was that my iphone arrived earlier and was almost $300 cheaper than theirs. I would recommend Ocean Reef Electronics to anyone who is interested in purchasing an iPhone 6 but doesn't want to pay $800-$900 for a ""brand new"" one.",1
Apple iPhone 6 128GB Silver AT&T,Apple,599.95,5,Love!,0
Apple iPhone 6 128GB Silver AT&T,Apple,599.95,3,"Some times its working and sometimes its going off, updated with the dealer, requested me to send the phone back but again we have monitor 4 more days and its working fine now; We dont want to return that piece as we already accoustam with the mobile & configured many things :-)",2
Apple iPhone 6 128GB Silver AT&T,Apple,599.95,5,"Yes, it was exactly as I expected.",0
Apple iPhone 6 128GB Silver AT&T,Apple,599.95,5,I love this phone. It's like new.It worked well for t mobile. You can unlock your phone at iphoneimei.info. It's cheap and fast since this phone was for att I had to unlocked but it works really well. Buy this phone from Amazon and unlocked at iphoneimei.info.,6
Apple iPhone 6 128GB Silver AT&T,Apple,599.95,5,"I bought the 64gb one used. At first the wall charger didn't work. I wrote to the seller and he sent me a replacement plus a free charging wire, plus a $10 Amazon gift certificate. Phone also works perfectly. Amazing service. I highly recommend the seller, Aruba, as well as the iPhone 6.",3
Apple iPhone 6 128GB Silver AT&T,Apple,599.95,4,"The phone shipped quickly, and arrived in perfect working order. I gave 4 stars because it was advertised as like new, but the charging port is a bit bent. Other than that, I am very satisfied.",2
Apple iPhone 6 128GB Silver AT&T,Apple,599.95,5,All good,0
Apple iPhone 6 128GB Silver AT&T,Apple,599.95,5,"I am upgrading from an iPhone 5s to this iPhone 6 off contract for the At&t network. I have started to stay 1-2 generations behind because buying new phones outright off contract in the current generation is just too expensive. Overall I am loving the new phone and larger screen size. The seller I got it from sold it as like new, and it fit the description very well. The seller was WBB LLC, and based on this purchase I would recommend them. The phone came with only 1 charge cycle on it! And cost $369.99 without any tax, got lucky even though I am in California and most items on Amazon charge tax in California now. I also bought it with my Prime Store Card and got 5% back, so overall I am please with the deal I got. Especially since this phone runs for $549.99 or higher and tax on top of that. Only thing is I do not have any warranty on the phone, but iPhones tend to have higher quality than android phones and if it does not have any problems the first 30 days, it should last you the life of the device before you want to upgrade. Battery life, screen quality, and speed are all great and slightly faster than the 5s.",0
Apple iPhone 6 128GB Silver AT&T,Apple,599.95,5,"Perfect condition, saved a lot of money.",1
Apple iPhone 6 128GB Silver AT&T,Apple,599.95,5,Excellent item,0
Apple iPhone 6 128GB Silver AT&T,Apple,599.95,5,I love it,0
Apple iPhone 6 128GB Silver AT&T,Apple,599.95,5,Love my iphone 6!,0
Apple iPhone 6 128GB Silver AT&T,Apple,599.95,5,What a great deal! Phone came and looked brand new except for the ear buds. i have others so no big deal. My daughter had bought my granddaughter a iPhone 6 and paid 700$ for it.,0
Apple iPhone 6 128GB Silver AT&T,Apple,599.95,5,I love my iPhone no problems with it yet.,0
Apple iPhone 6 128GB Silver AT&T,Apple,599.95,5,Love it!,0
Apple iPhone 6 128GB Silver AT&T,Apple,599.95,5,Received the phone earlier than expected. Came in very good condition like it was described. Works great and had no problem activating it. Overall great experience with this seller.,0
Apple iPhone 6 128GB Silver AT&T,Apple,599.95,5,"Great phone, I love it!!",0
Apple iPhone 6 128GB Silver AT&T,Apple,599.95,4,Product works great unfortunately several areas in the design were limited such as water / bean capacity,0
Apple iPhone 6 128GB Silver AT&T,Apple,599.95,5,"I absolutely love this phone. I've had the same iPhone 5 since December 2014 and it was in pitiful shape, dropped way too many times... this iPhone 6 is like going from eating hamburger to steak! Haha",0
Apple iPhone 6 128GB Silver AT&T,Apple,599.95,5,"Awesome deal, great phone, great price, quick delivery. Thank you.",0
Apple iPhone 6 128GB Silver AT&T,Apple,599.95,4,"The product would have been fine, but it was not fully functional. I had to return it in the end. The return process was very easy and refund/exchange was offered with the utmost courtesy.",0
Apple iPhone 6 128GB Silver AT&T,Apple,599.95,5,"I absolutely love this phone. Sure it's not the latest one, but it gets the job done. Battery life sucks, yes, but that's okay. Camera quality is good enough, and the colors available is great! Awesome phone.",0
Apple iPhone 6 128GB Silver AT&T,Apple,599.95,4,Reached,1
Apple iPhone 6 128GB Silver AT&T,Apple,599.95,1,"Hello, I wanted to unlock the phone on AT & T and I respond that I pay to unlock the phone.I need you to unlock my phone and reminded me.That data need to unlock AT & T?Otherwise I'll open a case on Amazon because you have cheated me.",2
Apple iPhone 6 128GB Silver AT&T,Apple,599.95,1,"In the explanation part it was saying that the phone was factory unlocked, I took it my country but it didn't work. Because it wasn't factory unlocked! I want to return this item but unable contact the seller!",0
Apple iPhone 6 128GB Silver AT&T,Apple,599.95,5,"undamaged beside product description, works perfectly. I am EXTREMELY happy",0
Apple iPhone 6 128GB Silver AT&T,Apple,599.95,5,great item,0
Apple iPhone 6 128GB Silver AT&T,Apple,599.95,5,"Excellent customer service, reasonable price and the iphone 6 I bought was more than what I expected!",0
Apple iPhone 6 128GB Silver AT&T,Apple,599.95,3,Only downfall is the front camera shifted but the phone is in good shape.,2
Apple iPhone 6 128GB Silver AT&T,Apple,599.95,5,"Very good condition when I got it even though the description was ""acceptable."" Came with a working charger and everything is working perfectly!",3
Apple iPhone 6 128GB Silver AT&T,Apple,599.95,4,"Phone was as good as described, price was reasonable, service and delivery were excellent. Good seller, good product.",1
Apple iPhone 6 128GB Silver AT&T,Apple,599.95,5,Love it work great with different carrier such as Tracfone.,0
Apple iPhone 6 128GB Silver AT&T,Apple,599.95,5,"Perfect, my wife loved it.",1
Apple iPhone 6 128GB Silver AT&T,Apple,599.95,4,pretty stratified wit this purchase. Brand new and hadn't been opened. No complainants.,2
Apple iPhone 6 128GB Silver AT&T,Apple,599.95,5,"i just got my phone and so far i really like it,i have the iphone 6plus and it is just to big for me so i purchased this one and really like the size better, its a 6 and not a 6S but not sure what the difference is and dont really care, its a great phone, i would purchase from this vender again.",0
Apple iPhone 6 128GB Silver AT&T,Apple,599.95,5,So far no problems. Working great and came when expected,1
Apple iPhone 6 128GB Silver AT&T,Apple,599.95,5,I love it,1
Apple iPhone 6 128GB Silver AT&T,Apple,599.95,5,"Love it , is in very good condition and very good working. Very fast shipping.",0
Apple iPhone 6 128GB Silver AT&T,Apple,599.95,5,"Everything was as explained! I am beyond happy with my purchase everything was packaged well & mine came with a charger, wall adapter, and the apple ear phones! My phone works and looks like new. There is not one scratch or crack on it. I am one happy customer and pleased with my purchase. Also i got one thats for at&t but i am with straight talk all i did was put my sim card in this phone and it works great ! I did not have to unlock it ! Just in case any one was from straight talk and was wondering if it worked with this phone!!!",0
Apple iPhone 6 128GB Silver AT&T,Apple,599.95,4,the imei could not be unlocked because of fails of payment.,0
Apple iPhone 6 128GB Silver AT&T,Apple,599.95,5,I LOVE MY PHONE I know it says refurbished my phone came brand new no dents cracks or any problems and the Imei is clean I order this from panda or panga deals . However you say it you'll know when you see the name but I recommend them .,0
Apple iPhone 6 128GB Silver AT&T,Apple,599.95,5,"This is the phone I have been wanting for a little while. I got it in better condition than expected! This phone is amazing! Product rated as Very Good condition was in better condition than that! Iphone speaks for itself when it comes to quality products, so this is well worth my money.",0
Apple iPhone 6 128GB Silver AT&T,Apple,599.95,5,Love it,0
Apple iPhone 6 128GB Silver AT&T,Apple,599.95,4,No problems with it so far. Perfect cosmetic condition. Good purchase.,0
Apple iPhone 6 128GB Silver AT&T,Apple,599.95,5,very nice,0
Apple iPhone 6 128GB Silver AT&T,Apple,599.95,4,The phone is great but I ordered an ATT phone and it arrived with a Verizon SIM card in it?,0
Apple iPhone 6 128GB Silver AT&T,Apple,599.95,2,"Having purchased what was advertised as a new iPhone i was pretty shocked when I opened the box and found a filthy, greasy mess. This phone was not new and had been handled by someone eating fried chicken or similar. The protective cover had been removed and poorly replaced complete with greasy fingerprints. Disgusting !",7
Apple iPhone 6 128GB Silver AT&T,Apple,599.95,5,good,0
Apple iPhone 6 128GB Silver AT&T,Apple,599.95,5,Product was just as described. I am very satisfied.,8
Apple iPhone 6 128GB Silver AT&T,Apple,599.95,5,PERFECT AND AWSOME,0
Apple iPhone 6 128GB Silver AT&T,Apple,599.95,5,Great phone,1
Apple iPhone 6 128GB Silver AT&T,Apple,599.95,1,When I read the article description i thought that i would buy a nice iPhone in good conditions for a nice price.After using it a few times i got shocked and very anoyed because the cellphone has a displaydamage.There is a line in the display probably caused by letting the phone fell down.The description said nothing about it so i feel quiet engaged by the sellar!!!,0
Apple iPhone 6 128GB Silver AT&T,Apple,599.95,4,"the charger doesn't work, phone is excellent",1
Apple iPhone 6 128GB Silver AT&T,Apple,599.95,5,iPhone at this time has no problems.,1
Apple iPhone 6 128GB Silver AT&T,Apple,599.95,5,Great phone no flaws or anything. Worked right out the box,0
Apple iPhone 6 128GB Silver AT&T,Apple,599.95,5,I ordered this phone and it exceeded my expectations. No visible damage to the body or screen and the screen looked almost brand new. The phone touch screen works great and is very responsive. Great work refurbishing work!,0
Apple iPhone 6 128GB Silver AT&T,Apple,599.95,5,"An absolute masterpiece. The mother of all funny books. As funny as her stand-up, and I MEAN it.I couldn't put it down, and not just because it was Crazy Glued to my hand. It's pee your pants funny.",0
Apple iPhone 6 128GB Silver AT&T,Apple,599.95,5,The phone came very early-awesome! So far it's wonderful. No scratches or scrapes and easy to set up.,0
Apple iPhone 6 128GB Silver AT&T,Apple,599.95,5,Works greats and in good condition. Also very fast shipping loved it,0
Apple iPhone 6 128GB Silver AT&T,Apple,599.95,1,Bad battery does not keep a charge...,0
Apple iPhone 6 128GB Silver AT&T,Apple,599.95,5,Exactly what I expected,1
Apple iPhone 6 128GB Silver AT&T,Apple,599.95,5,Thanks Very good for phone,0
Apple iPhone 6 128GB Silver AT&T,Apple,599.95,5,Really good phone works great so far,0
Apple iPhone 6 128GB Silver AT&T,Apple,599.95,2,"WINE NOT SEALED OR NEW as described, DISAPPOINTED",2
Apple iPhone 6 128GB Silver AT&T,Apple,599.95,2,I'm not happy with the lay on plastic screen cover. It practically attracts dirt to both the top and bottom of the plastic screen no matter how carefully it is applie or cared for.,0
Apple iPhone 6 128GB Silver AT&T,Apple,599.95,5,ok,0
Apple iPhone 6 128GB Silver AT&T,Apple,599.95,4,Overall the iphone is great. Giving it solid 4/5,2
Apple iPhone 6 128GB Silver AT&T,Apple,599.95,5,Perfect like described... Tks,0
Apple iPhone 6 128GB Silver AT&T,Apple,599.95,5,Great phone for great price,0
Apple iPhone 6 128GB Silver AT&T,Apple,599.95,5,Took a chance on a new seller with a big purchase and my gamble paid off 🙌🏾,0
Apple iPhone 6 128GB Silver AT&T,Apple,599.95,5,Met the description and I got it before the expected delivery date!,0
Apple iPhone 6 128GB Silver AT&T,Apple,599.95,1,"Huge issue with this order, the phone I received is stolen. It worked fine oversees, but once I got back and inserted a us sim, the phone get locked, it is registered to a stolen phone in US, I am also writing to amazon regarding this issue.",13
Apple iPhone 6 128GB Silver AT&T,Apple,599.95,5,Amazing product! Cams early!,0
Apple iPhone 6 128GB Silver AT&T,Apple,599.95,2,I couldn't hear good on the phone,0
Apple iPhone 6 128GB Silver AT&T,Apple,599.95,5,One month in and i have had no issues whatsoever with the phone. It came in perfect working order and has maintained that order.,0
Apple iPhone 6 128GB Silver AT&T,Apple,599.95,2,"The phone I bought isn't an AT&T phone. The SIM card from AT&T didn't work, the rep at the store said he doesn't know who the carrier is, but it's not them. Returning it.",0
Apple iPhone 6 128GB Silver AT&T,Apple,599.95,5,Excellent product....very satisfied with seller....delivered in very timely matter....thank you!,0
Apple iPhone 6 128GB Silver AT&T,Apple,599.95,4,Phone was in excellent physical condition,1
